30720542,precision medicine,"With the advent of therapeutic hypothermia for treatment of hypoxic ischemic encephalopathy, and improvements in neuroimaging and bedside neuromonitoring, a new era of neonatal brain-focused care has emerged in recent years. We describe the development of the first neurointensive care nursery (NICN) as a model for comanagement of neonates with identified neurologic risk factors by a multidisciplinary team constituted of neurologists, neonatologists, specialized nurses, and others with the goal of optimizing management, preventing secondary injury and maximizing long-term outcomes."
30719868,precision medicine,"A growing body of evidence has substantiated the significance of quantitative phase imaging (QPI) in enabling cost-effective and label-free cellular assays, which provide useful insights into understanding biophysical properties of cells and their roles in cellular functions. However, available QPI modalities are limited by the loss of imaging resolution at high throughput and thus run short of sufficient statistical power at the single cell precision to define cell identities in a large and heterogeneous population of cells - hindering their utility in mainstream biomedicine and biology. Here we present a new QPI modality, coined multi-ATOM that captures and processes quantitative label-free single-cell images at ultra-high throughput without compromising sub-cellular resolution. We show that multi-ATOM, based upon ultrafast phase-gradient encoding, outperforms state-of-the-art QPI in permitting robust phase retrieval at a QPI throughput of >10,000 cell/sec, bypassing the need for interferometry which inevitably compromises QPI quality under ultrafast operation. We employ multi-ATOM for large-scale, label-free, multi-variate, cell-type classification (e.g. breast cancer sub-types, and leukemic cells versus peripheral blood mononuclear cells) at high accuracy (>94%). Our results suggest that multi-ATOM could empower new strategies in large-scale biophysical single-cell analysis with applications in biology and enriching disease diagnostics. This article is protected by copyright. All rights reserved."
30719129,precision medicine,"<b>Background:</b> Methylation plays a significant role in the etiology and pathogenesis of hepatocellular carcinoma (HCC). The aim of the present study is to identify aberrantly methylated-diferentially expressed genes (DEGs) and dysregulated pathways associated with the development of HCC through integrated analysis of gene expression and methylation microarray. <b>Method:</b> Aberrantly methylated-DEGs were identified from gene expression microarrays (GSE62232, GSE74656) and gene methylation microarrays (GSE44909, GSE57958). Functional enrichment and pathway enrichment analyses were performed through the database of DAVID. Protein-protein interaction (PPI) network was established by STRING and visualized in Cytoscape. Subsequently, overall survival (OS) analysis of hub genes was performed by OncoLnc. Finally, we validated the expression level of CDCA5 by quantitative real-time PCR (qRT-PCR) and western blotting, and performed Immunohistochemical experiments utilizing a tissue microarray. Cell growth assay and flow cytometry were behaved to explore the function of CDCA5. <b>Results:</b> Aberrantly methylated-DEGs were enriched in biological process, molecular function, cellular component and Kyoto Encyclopedia of Genes and Genomes (KEGG) pathway. Among them, cell cycle was enriched most frequently, and some terms associated with cancer were enriched, such as p53 signaling pathway, pathways in cancers, PI3K-Akt signaling pathway and AMPK signaling pathway. After survival analysis and validation in TCGA database including methylation and gene expression status, 12 hub genes were identified. Furthermore, the expression level of new gene CDCA5 was validated in HCC cell lines and hepatic normal cell lines through qRT-PCR and western blotting. In additional, immunohistochemistry experiments revealed higher CDCA5 protein expression from HCC tumor tissues compared with paracancer tissues by tissue microarray. Finally, through loss of function, we demonstrated that CDCA5 promoted proliferation by regulating the cell cycle. <b>Conclusions:</b> In summary, the present study implied possible aberrantly methylated-differentially expressed genes and dysregulated pathways in HCC by bioinformatics analysis and experiments, which could be helpful in understanding the molecular mechanisms underlying the development and progression of HCC. Hub genes including CDC20, AURKB, BIRC5, RRM2, MCM2, PTTG1, CDKN2A, NEK2, CENPF, RACGAP1, GNA14 and especially the new gene CDCA5 may serve as biomarkers for diagnosis, treatment and prognosis of HCC."
30719021,precision medicine,"The terms ""prevention"" and ""risk reduction"" are often used interchangeably in medicine. There is considerable debate, however, over the use of these terms in describing interventions that aim to <i>preserve cognitive health</i> and/or <i>delay disease progression</i> of Alzheimer's disease (AD) for patients seeking clinical care. Furthermore, it is important to distinguish between Alzheimer's <i>disease</i> prevention and Alzheimer's <i>dementia</i> prevention when using these terms. While prior studies have codified research-based criteria for the progressive stages of AD, there are no clear clinical consensus criteria to guide the use of these terms for physicians in practice. A clear understanding of the implications of each term will help guide clinical practice and clinical research. The authors explore the semantics and appropriate use of the terms ""prevention"" and ""risk reduction"" as they relate to AD in clinical practice."
30718897,precision medicine,"Acetaminophen (APAP) is a commonly used analgesic responsible for more than half of acute liver failure cases. Identification of previously unknown genetic risk factors would provide mechanistic insights and novel therapeutic targets for APAP-induced liver injury. This study used a genome-wide CRISPR-Cas9 screen to evaluate genes that are protective against, or cause susceptibility to, APAP-induced liver injury. HuH7 human hepatocellular carcinoma cells containing CRISPR-Cas9 gene knockouts were treated with 15 mM APAP for 30 minutes to 4 days. A gene expression profile was developed based on the 1) top screening hits, 2) overlap of expression data from APAP overdose studies, and 3) predicted affected biological pathways. We further demonstrated the implementation of intermediate time points for the identification of early and late response genes. This study illustrated the power of a genome-wide CRISPR-Cas9 screen to systematically identify novel genes involved in APAP-induced hepatotoxicity and to provide potential targets to develop novel therapeutic modalities."
30718607,precision medicine,"Conventional radiation therapy of brain tumors often produces cognitive deficits, particularly in children. We investigated the potential efficacy of merging Orthovoltage X-ray Minibeams (OXM). It segments the beam into an array of parallel, thin (~0.3 mm), planar beams, called minibeams, which are known from synchrotron x-ray experiments to spare tissues. Furthermore, the slight divergence of the OXM array make the individual minibeams gradually broaden, thus merging with their neighbors at a given tissue depth to produce a solid beam. In this way the proximal tissues, including the cerebral cortex, can be spared. Here we present experimental results with radiochromic films to characterize the method's dosimetry. Furthermore, we present our Monte Carlo simulation results for physical absorbed dose, and a first-order biologic model to predict tissue tolerance. In particular, a 220-kVp orthovoltage beam provides a 5-fold sharper lateral penumbra than a 6-MV x-ray beam. The method can be implemented in arc-scan, which may include volumetric-modulated arc therapy (VMAT). Finally, OXM's low beam energy makes it ideal for tumor-dose enhancement with contrast agents such as iodine or gold nanoparticles, and its low cost, portability, and small room-shielding requirements make it ideal for use in the low-and-middle-income countries."
30718482,precision medicine,"During meiotic prophase I, telomeres attach to and move on the nuclear envelope (NE), regulating chromosome movement to promote homologous pairing. Meiosis-specific proteins TERB1, TERB2 and MAJIN play a key role in this process. Here, we report the crystal structures of human TERB1-TERB2 and TERB2-MAJIN subcomplexes. Specific disruption of the TERB1-TERB2 or the TERB2-MAJIN interaction in the mouse Terb2 gene abolishes the telomere attachment to the NE and causes aberrant homologous pairing and disordered synapsis. In addition, depletion of SUN1 also partially disrupts the telomere-NE connection. We propose that the telomere-TRF1-TERB1-TERB2-MAJIN-NE interaction network and the telomere-LINC complex connection are likely two separate but cooperative pathways to stably recruit telomeres to the NE in meiosis prophase I. Our work provides a molecular model of the connection between telomeres and the NE and reveals the correlation between aberrant synapsis and the defective telomere attachment to the NE."
30718465,precision medicine,"We searched for genetic causes of major psychiatric disorders (bipolar disorder, schizoaffective disorder, and schizophrenia) in a large, densely affected pedigree from Northern Sweden that originated with three pairs of founders born around 1650. We applied a systematic genomic approach to the pedigree via karyotyping (N = 9), genome-wide SNP arrays (N = 418), whole-exome sequencing (N = 26), and whole-genome sequencing (N = 10). Comprehensive analysis did not identify plausible variants of strong effect. Rather, pedigree cases had significantly higher genetic risk scores compared to pedigree and community controls."
30718392,precision medicine,"Sepsis claims an estimated 30 million episodes and 6 million deaths per year, and treatment options are rather limited. Human neutrophil peptides 1-3 (HNP1-3) are the most abundant neutrophil granule proteins but their neutrophil content varies because of unusually extensive gene copy number polymorphism. A genetic association study found that increased copy number of the HNP-encoding gene <i>DEFA1/DEFA3</i> is a risk factor for organ dysfunction during sepsis development. However, direct experimental evidence demonstrating that these risk alleles are pathogenic for sepsis is lacking because the genes are present only in some primates and humans. Here, we generate <i>DEFA1/DEFA3</i> transgenic mice with neutrophil-specific expression of the peptides. We show that mice with high copy number of <i>DEFA1/DEFA3</i> genes have more severe sepsis-related vital organ damage and mortality than mice with low copy number of <i>DEFA1/DEFA3</i> or wild-type mice, resulting from more severe endothelial barrier dysfunction and endothelial cell pyroptosis after sepsis challenge. Mechanistically, HNP-1 induces endothelial cell pyroptosis via P2X7 receptor-mediating canonical caspase-1 activation in a NLRP3 inflammasome-dependent manner. Based on these findings, we engineered a monoclonal antibody against HNP-1 to block the interaction with P2X7 and found that the blocking antibody protected mice carrying high copy number of <i>DEFA1/DEFA3</i> from lethal sepsis. We thus demonstrate that <i>DEFA1/DEFA3</i> copy number variation strongly modulates sepsis development in vivo and explore a paradigm for the precision treatment of sepsis tailored by individual genetic information."
30717821,precision medicine,"<i>Background</i>: The applications of deoxyribonucleic acid (DNA) barcoding methods have been extended from authenticating taxonomic provenance of animal products to identifying botanicals used as herbal medicine and in botanical dietary supplements. DNA barcoding methods for botanical identification must be adequately validated to meet regulatory compliance. <i>Objective</i>: The goal of this study is to provide a validation protocol for a two-tiered DNA barcoding method that aims to identify raw botanicals. <i>Methods</i>: A barcode database was computationally validated to define the barcode combinations that can unambiguously identify botanicals in the database. A maximum variation sampling technique was used to capture a wide range of perspectives relating to DNA barcode-based botanical identification, including plant parts and species distance, for the experimental validation. Twenty-two authenticated botanicals were purposively sampled from different plant parts-covering both closely related and distantly related species-to validate the two-tiered DNA barcoding method. The performance of the method was assessed on accuracy, precision, ruggedness, and uncertainty. <i>Results</i>: High accuracy (100%) and precision (1.0) were obtained from the validation samples. The method was also found to be rugged and have acceptable uncertainty. <i>Conclusions</i>: The method was validated and suitable for DNA-based identification of botanical raw materials listed in the current database. <i>Highlights</i>: This work will provide support guidance for manufacturers and regulatory policy makers to implement equivalent validated and compliant DNA-based testing in quality control processes to improve botanical raw material identification and authentication."
30717767,precision medicine,"CRISPR-Cas12a/Cpf1, a single RNA-guided endonuclease system, provides a promising tool for genome engineering. However, only three Cas12a orthologs have been employed for mammalian genome editing, and the editing efficiency as well as targeting coverage still requires improvements. Here, we harness six novel Cas12a orthologs for genome editing in human and mouse cells, some of which utilize simple protospacer adjacent motifs (PAMs) that remarkably increase the targeting range in the genomes. Moreover, we identify optimized CRISPR RNA (crRNA) scaffolds that can increase the genome editing efficiency of Cas12a."
30717118,precision medicine,"Cardiovascular disease (CVD) is the leading cause of death in the United States (US), with familial hypercholesterolemia (FH) being a major inherited and genetic risk factor for premature CVD and atherosclerosis. Genetic testing has helped patients and providers confirm the presence of known pathogenic and likely pathogenic variations in FH-associated genes. Key organizations, such as the Centers for Disease Control and Prevention (CDC), American Heart Association (AHA), FH Foundation, and National Lipid Association (NLA), have recognized the clinical utility of FH genetic testing. However, FH genetic testing is underutilized in clinical practice in the US for reasons that are underexplored through the lens of implementation science. In this commentary, we discuss seven key implementation challenges that must be overcome to strengthen the clinical adoption of FH genetic testing in the US. These implementation challenges center on evidence of cost-effectiveness, navigating patient and provider preferences and concerns, gender and ethnic diversity and representation in genetic testing, and establishing clinical consensus around FH genetic testing based on the latest and most relevant research findings. Overcoming these implementation challenges is imperative to the mission of reducing CVD risk in the US."
30716600,precision medicine,"A simultaneous quantitative profiling method for androgens and prostaglandins using ultra-high-performance liquid chromatography-tandem mass spectrometry was developed and validated to evaluate urinary androgen and prostaglandin levels. Solid-phase extraction and liquid-liquid extraction steps were combined during the sample preparation. β-Glucuronidase/arylsulfatase was also used in the enzyme hydrolysis step. Chemical derivatization was performed using 2-hydrazinopyridine for simultaneous determination of androgen and prostaglandin in the same ionization mode. The analytes were all separated and measured using multiple reaction monitoring in the positive ion mode within a run time of 22 min. The method was validated, achieving overall recoveries ranging from 81.0 to 102.9% with limits of quantification ranging from 0.01 to 2 ng/mL. The intra-day accuracy and precision ranged from 6.5 to 14.3% and from 77.1 to 106.8%, respectively. The inter-day accuracy and precision ranged from 8.9 to 18.2% and 89.9 to 101.4%, respectively. The linearity was expressed using the correlation coefficient, which was >0.99. The method developed herein was used to investigate the effects of a one-year finasteride treatment through differences in urinary androgen and prostaglandin levels between treated male pattern baldness patients and normal controls. The urinary androgen and prostaglandin levels were not significantly different between the two groups because of the administration of finasteride. The results confirmed that finasteride affects androgens and PGs related to hair regrowth and growth length, and a one-year finasteride treatment is effective for MPB. The mass spectrometry-based quantitative profiling method used herein for the investigation of male pattern baldness also holds great potential for the evaluation of androgens and prostaglandins associated with the metabolism of various inflammatory diseases."
30716590,precision medicine,"Cardiovascular diseases, cancer, and diabetes are high mortality diseases, which account for almost two thirds of all deaths worldwide. Their early detection and continuous evaluation are﻿ fundamental for an improved patient prognosis and reduced socioeconomic impact. Current biosensor technologies are typically based on the analysis of whole blood samples from patients for the detection of disease-specific biomarkers. However, these technologies display serious shortcomings, such as reduced sensitivity and dynamic range, limited in vivo applicability, and lack of continuous monitoring. There is the urgent need for new diagnostic and treatment follow-up tools, which allow for the early detection of the pathology as well as for the continuous monitoring of the physiological responses to specific therapies. During the last years, a new generation of biosensor technologies with improved performance has emerged in the biomedical sector. The combination of advanced biomaterial methods, biochemical tools, and micro/nanotechnology approaches has resulted in the development of innovative three-dimensional (3D) biosensor platforms for advanced medical diagnosis. In this review, we report the most recent advances in the field of 3D biosensors for clinical applications, focusing on the diagnosis and monitoring of cardiovascular diseases, cancer, and diabetes. We discuss about their clinical performance compared to standard biosensor technologies, their implantable capability, and their integration into microfluidic devices to develop clinically-relevant models. Overall, we anticipate that 3D biosensors will drive us toward a new paradigm in medical diagnosis, resulting in real-time in vivo biosensors capable to significantly improve patient prognosis."
30716582,precision medicine,The aim of this study was to identify whether diastolic dysfunction predicts death at 90 days after acute ischemic stroke.
30715914,precision medicine,"The emergence of biobanks has expanded the scope of biomedical research, ushering in an era of ""precision medicine"" to improve the treatment of disease. However, biobanks also face sustainability challenges comprising three dimensions-""financial,"" ""operational,"" and ""social."" The Taiwan Biobank (TWB), as a large-scale national biobank that supplies valuable phenotypic and genetic information to biomedical researchers on an application basis to investigate the relationship among personal health, genes, lifestyle, environment and diseases of the Taiwanese population, has not been sufficiently explored by researchers. Although the TWB has successfully reached a few milestones since its inception, it faces many sustainability challenges. For the next chapter of the TWB, we propose three strategies to improve sustainability. First, the Ministry of Health and Welfare launched the TWB as an infrastructure project under the leadership of Academia Sinica in 2012. We now believe that it is time that the TWB is transformed into a legal entity as a nondepartmental public body. This would not only ensure efficient, effective, and flexible operation, but would also facilitate cooperation with commercial entities. Second, we suggest that the TWB integrates with other Taiwanese biobanks to reduce cost, improve low utilization, and expand specimen collection. Third, self-financing is important if funding is ceased. Besides implementing a cost-recovery model, the commodities developed by the TWB (e.g., TWB 2.0 microarray) will help increase income. After each of these strategies has been discussed in detail, this article will conclude by highlighting how these practices can help improve biobank sustainability."
30715796,precision medicine,The biased T helper 2 (Th2) responses play a critical role in the pathogenesis of allergy. The underlying mechanism is not fully understood yet. Survivin can regulate multiple cellular activities. This study aims to elucidate the role of survivin in the development and maintenance of Th2 polarization.
30715603,precision medicine,"In this review, we highlight the pre-clinical development, recent clinical studies, and future directions of larotrectinib in patients with NTRK fusion-positive tumors."
30715595,precision medicine,"Most validations of paediatric glomerular filtration rate (GFR) estimating equations using standardized creatinine (CR) and cystatin C (CYS) assays have comprised relatively small cohorts, which makes accuracy across subgroups of GFR, age, body mass index (BMI) and gender uncertain. To overcome this, a large cohort of children referred for GFR determination has been established from several European medical centres."
30715152,precision medicine,"Crosstalk between competing endogenous RNAs (ceRNAs) is mediated by shared microRNAs (miRNAs) and plays important roles both in normal physiology and tumorigenesis; thus, it is attractive for systems-level decoding of gene regulation. As ceRNA networks link the function of miRNAs with that of transcripts sharing the same miRNA response elements (MREs), e.g. pseudogenes, competing mRNAs, long non-coding RNAs, and circular RNAs, the perturbation of crucial interactions in ceRNA networks may contribute to carcinogenesis by affecting the balance of cellular regulatory system. Therefore, discovering biomarkers that indicate cancer initiation, development, and/or therapeutic responses via reconstructing and analyzing ceRNA networks is of clinical significance. In this review, the regulatory function of ceRNAs in cancer and crucial determinants of ceRNA crosstalk are firstly discussed to gain a global understanding of ceRNA-mediated carcinogenesis. Then, computational and experimental approaches for ceRNA network reconstruction and ceRNA validation, respectively, are described from a systems biology perspective. We focus on strategies for biomarker identification based on analyzing ceRNA networks and highlight the translational applications of ceRNA biomarkers for cancer management. This article will shed light on the significance of miRNA-mediated ceRNA interactions and provide important clues for discovering ceRNA network-based biomarker in cancer biology, thereby accelerating the pace of precision medicine and healthcare for cancer patients."
30715037,precision medicine,"Electrical nerve recording and stimulation technologies are critically needed to monitor and modulate nerve activity to treat a variety of neurological diseases. However, current neuromodulation technologies presented in the literature or commercially available products cannot support simultaneous recording and stimulation on the same nerve. To solve this problem, a new bidirectional neuromodulation system-on-chip (SoC) is proposed in this paper, which includes a frequency-shaping neural recorder and a fully integrated neural stimulator with charge balancing capability. In addition, auxiliary circuits consisting of power management and data transmission circuits are designed to provide the necessary power supply for the SoC and the bidirectional data communication between the SoC and an external computer via a universal serial bus (USB) interface, respectively. To achieve sufficient low input noise for sensing nerve activity at a sub-10 μ V range, several noise reduction techniques are developed in the neural recorder. The designed SoC was fabricated in a 0.18 μ m high-voltage Bipolar CMOS DMOS (BCD) process technology that was described in a previous publication and it has been recently tested in animal experiments that demonstrate the proposed SoC is capable of achieving reliable and simultaneous electrical stimulation and recording on the same nerve."
30714973,precision medicine,Data regarding the relative safety profile of anti-malarial drugs in pregnancy is sparse mainly limited by the absence of head-to-head clinical trials. The present study is a network meta-analysis of safety of anti-malarial drugs used to treat malaria in pregnant women.
