30726160,precision medicine,"The Arf and Rab/Ypt GTPases coordinately regulate membrane traffic and organelle structure by regulating vesicle formation and fusion. Ample evidence has indicated that proteins in these two families may function in parallel or complementarily; however, the manner in which Arf and Rab/Ypt proteins perform interchangeable function remains unclear. In this study, we report that a Golgi-localized Arf, Arl1, could suppress the Ypt6 dysfunction via its effector golgin, Imh1, but not via the lipid flippase Drs2. Ypt6 is critical for the retrograde transport of vesicles from endosomes to the TGN, and its mutation leads to severe protein mislocalization and growth defects. We first overexpress the components of the Arl3-Syt1-Arl1-Imh1 cascade and show that only Arl1 and Imh1 can restore endosome-to-TGN trafficking in ypt6-deleted cells. Interestingly, increased abundance of Arl1 or Imh1 restores localization of the tethering factor Golgi-associated retrograde protein (GARP) complex to the TGN in the absence of Ypt6. We further show that the N-terminal domain of Imh1 is critical for restoring GARP localization and endosome-to-TGN transport in ypt6-deleted cells. Together, our results reveal the mechanism by which Arl1-Imh1 facilitates the recruitment of GARP to the TGN and compensates for the endosome-to-TGN trafficking defects in dysfunctional Ypt6 conditions."
30726120,precision medicine,"Severe asthma affects a small proportion of asthma patients (~ 3-5%) and reflects a failure of conventional asthma medications to provide adequate control. Severe asthma is a disease of significant clinical heterogeneity, likely caused by different pathobiological mechanisms, frequently referred to as endotypes. In the last decade, multiple monoclonal therapies have been developed to target airway type-2 eosinophilic and/or allergic severe asthma. However, the underlying mechanisms of both type 2 immunity and eosinophilia (blood and airway) remain incompletely understood and offer a potential for novel therapies that target eosinophil maturation in the bone marrow and specific kinases expressed in type 2 cells, such as JAK-STAT inhibitors. Furthermore, some patients do not consistently demonstrate a type 2 disease clinical profile and display other inflammatory phenotypes at a given point in time. Targeting airway smooth muscle dysfunction, airway mucous, type-17 immunity and airway dysbiosis, may represent novel therapeutic approaches for severe asthma in the future. Unfortunately, the biomarkers for these subtypes of severe asthma are underdeveloped, rendering it difficult to conduct effective clinical trials. There are also barriers regarding the efficiency of standard clinical trials. Moving beyond these barriers will require innovation in trial design, effective partnerships with patient groups and effective multi-national trials consortia. There are current transatlantic opportunities to conduct clinical trials that could facilitate the development of common trial platforms to maximize overall efficiency and move the field of severe asthma forward."
30726072,precision medicine,"A small molecule (1) with overlapping affinity for two microRNA (miRNA) precursors was used to inform design of a dimeric compound (2) selective for one of the miRNAs. In particular, 2 selectively targets the microRNA(miR)-515 hairpin precursor to inhibit production of miR-515 that represses sphingosine kinase 1 (SK1), a key enzyme in the biosynthesis of sphingosine 1-phosphate (S1P). Application of 2 to breast cancer cells enhanced SK1 and S1P levels, triggering a migratory phenotype. Knockout of SK1, forced overexpression of miR-515, and application of a small molecule SK1 inhibitor all ablated 2's effect on phenotype, consistent with its designed mode of action. Target profiling studies via Chem-CLIP showed that 2 bound selectively to the miR-515 hairpin precursor in cells. Global neoprotein synthesis upon addition of 2 to MCF-7 breast cancer cells demonstrated 2's selectivity and upregulation of cancer-associated proteins regulated by S1P. The most upregulated protein was human epidermal growth factor receptor 2 (ERBB2/HER2), which is regulated by the SK1/S1P pathway and is normally not expressed in MCF-7 cells. Like triple negative breast cancer (TNBC) cells, the lack of HER2 renders them insusceptible to Herceptin and its antibody-drug conjugate Kadcyla. In addition to proteomics, an RNA-seq study supports that 2 has limited off target effects and other studies support that 2 is more selective than an oligonucleotide. We therefore hypothesized that 2 could sensitize MCF-7 cells to anti-HER2 therapies. Indeed, application of 2 sensitized cells to Herceptin. These results were confirmed in two other cell lines that express miR-515 and are HER2-, the hepatocellular carcinoma cell line HepG2 and the TNBC line MDA-MB-231. Importantly, normal breast epithelial cells (MCF-10A) that do not express miR-515 are not affected by 2. These observations suggest a precision medicine approach to sensitize HER2- cancers to approved anticancer medicines. This study has implications for broadening the therapeutic utility of known targeted cancer therapeutics by using a secondary targeted approach to render otherwise insensitive cells, sensitive to a targeted therapeutic."
30725476,precision medicine,"Macitentan is an endothelin receptor antagonist commonly used in the treatment of pulmonary arterial hypertension (PAH). A novel, rapid, simple and sensitive UPLC-MS/MS method was developed and validated for pharmacokinetic study and the determination of macitentan in PAH patients. Macitentan and bosentan which is used as internal standard were detected using APCI in positive ion and MRM mode by monitoring the mass transitions m/z 589.1→203.3 and 552.6→311.5, respectively. Chromatographic separation was performed on reverse phase C18 column (5 μm, 4.6 *150 mm) with a isocratic mobile phase, which consisted of water containing 0.2% acetic acid:acetonitrile (90:10, v/v) at a flow rate of 1 mL/min. Retention times were 1.97 and 1.72 min. for macitentan and IS, respectively. The calibration curve with high correlation coefficient (0.9996) was linear range 1-500 ng/mL. The LLOQ and average recovery values were determined as 1 ng/mL and 89.8%, respectively. This method is the first UPLC-MS/MS method developed and validated for the determination of macitentan from human plasma. The developed analytical method was fully validated for linearity, selectivity, specificity, accuracy, precision, sensitivity, stability, matrix effect and recovery according to FDA guidelines. The developed method applied successfully for pharmacokinetic study and the determination of macitentan in PAH patients."
30725385,precision medicine,"In Chapter 12, figure 1 was published with truncated texts within. This figure has now been replaced with a revised figure with the updated text."
30725265,precision medicine,"Capnography involves the measurement of end-tidal CO<sub>2</sub> (EtCO<sub>2</sub>) values to detect hypoventilation in patients undergoing sedation. In a previous study, we reported that initiating a flexible bronchoscopy (FB) examination only after detecting signs of hypoventilation could reduce the risk of hypoxemia without compromising the tolerance of the patient for this type of intervention. We hypothesize that hypoventilation status could be determined with greater precision by combining thoracic impedance-based respiratory signals, RESP, and EtCO<sub>2</sub> signals obtained from a nasal-oral cannula. Retrospective analysis was conducted on RESP and EtCO<sub>2</sub> waveforms obtained from patients during the induction of sedation using propofol for bronchoscopic examination in a previous study. EtCO<sub>2</sub> waveforms associated with hypoventilation were then compared with RESP patterns, patient variables, and sedation outcomes. Signals suitable for analysis were obtained from 44 subjects, 42 of whom presented indications of hypoventilation, as determined by EtCO<sub>2</sub> waveforms. Two subtypes of hypoventilation were identified by RESP: central-predominant (n = 22, flat line RESP pattern) and non-central-predominant (n = 20, RESP pattern indicative of respiratory effort with upper airway collapse). Compared to cases of non-central-predominant hypoventilation, those presenting central-predominant hypoventilation during induction were associated with a lower propofol dose (40.2 ± 18.3 vs. 60.8 ± 26.1 mg, p = 0.009), a lower effect site concentration of propofol (2.02 ± 0.33 vs. 2.38 ± 0.44 µg/ml, p = 0.01), more rapid induction (146.1 ± 105.5 vs. 260.9 ± 156.2 s, p = 0.01), and lower total propofol dosage (96.6 ± 41.7 vs. 130.6 ± 53.4 mg, p = 0.04). Hypoventilation status (as revealed by EtCO<sub>2</sub> levels) could be further classified by RESP into central-predominant or non-central-predominant types. It appears that patients with central-predominant hypoventilation are more sensitive to propofol during the induction of sedation. RESP values could be used to tailor sedation management specifically to individual patients."
30725173,precision medicine,"Metabolic alterations have implications in a spectrum of tissue functions and disease. Aided by novel molecular biological and computational tools, our understanding of physiological and pathological processes underpinning endocrine and endocrine-related disease has significantly expanded over the last decade. Herein, we focus on novel metabolomics-related methodologies in adrenal research: in situ metabolomics by mass spectrometry imaging, steroid metabolomics by gas and liquid chromatography-mass spectrometry, energy pathway metabologenomics by liquid chromatography-mass spectrometry-based metabolomics of Krebs cycle intermediates, and cellular reprogramming to generate functional steroidogenic cells and hence to modulate the steroid metabolome. All four techniques to assess and/or modulate the metabolome in biological systems provide tremendous opportunities to manage neoplastic and non-neoplastic disease of the adrenal glands in the era of precision medicine. In this context, we discuss emerging clinical applications and/or promising metabolic-driven research towards diagnostic, prognostic, predictive and therapeutic biomarkers in tumours arising from the adrenal gland and extra-adrenal paraganglia as well as modern approaches to delineate and reprogram adrenal metabolism."
30724748,precision medicine,"Wound area measurements provide an objective assessment of wound healing; however, most commonly used measurement techniques are imprecise."
30724742,precision medicine,"Adverse drug reactions (ADRs) are common and are the underlying cause of over a million serious injuries and deaths each year. The most familiar method to detect ADRs is relying on spontaneous reports. Unfortunately, the low reporting rate of spontaneous reports is a serious limitation of pharmacovigilance."
30724465,precision medicine,Flexitarian dieting is increasingly associated with health benefits. The study of postprandial metabolic response to vegan and animal diets is essential to decipher how specific diet components may mediate metabolic changes.
30724444,precision medicine,"Kawasaki disease (KD) is a systemic vasculitis syndrome that leads to coronary artery aneurysm (CAA). While echocardiography is the most important imaging modality for coronary artery assessment, a specific diagnostic biomarker complementary for CAA has not been reported. We aimed to analyze the profiles of exosomal miRNAs extracted from the serum of KD patients and controls to identify candidate biomarkers for CAA. Serum samples from 39 healthy children, 42 CAA patients, 38 coronary artery dilatation (CAD) patients and 45 virus-infected patients including 24 EBV patients and 21 ADV patients were randomly selected. Next generation sequencing was used to analyze serum exosomal miRNA to detect differentially expressed miRNAs. Biomarker candidates were validated by qRT-PCR. One hundred (and) ninety-six differentially expressed miRNAs (DEMs) were detected in CAA patients and healthy children. There were 70 DEMs and 140 DEMs in CAA patients versus CAD patients, and in CAA patients versus virus-infected patients, respectively. We selected the three most upregulated (let-7i-3p, miR-17-3p, and miR-210-5p) and the three most downregulated miRNAs (miR-6743-5p, miR-1246, and miR-6834-5p) in the DEMs, which were expressed differentially in CAA patients versus healthy children, and in CAA patients versus virus-infected patients, not in virus-infected patients versus healthy children, as biomarker candidates. Excluded DEMs of CAD and virus-infected patients, let-7i-3p was detected by sequence data analysis as a biomarker candidate for CAA patients, and then validated by qRT-PCR in a larger set of clinical samples. As a biomarker candidate, let-7i-3p provides an additional means of diagnosing CAA patients. Additionally, miRNA biomarkers complement ultrasonic imaging, allowing for greater diagnostic precision. © 2019 IUBMB Life, 2019."
30724425,precision medicine,"Colorectal cancer (CRC) is caused by genetic alterations, and comprehensive sequence analyses have revealed the mutation landscapes. In addition to somatic changes, genetic variations are considered important factors contributing to tumor development; however, our knowledge on this subject is limited. Familial adenomatous polyposis coli (FAP) is an autosomal-dominant inherited disease caused by germline mutations in the adenomatous polyposis coli (APC) gene. FAP patients are classified into two major groups based on clinical manifestations: classical FAP (CFAP) and attenuated FAP (AFAP). In this study, we established 42 organoids from three CFAP patients and two AFAP patients. Comprehensive gene expression analysis demonstrated a close association between IFN/STAT signaling and the phenotypic features of FAP patients. Genetic disruption of Stat1 in the mouse model of FAP reduced tumor formation, demonstrating that the IFN/STAT pathway is causally associated with the tumor-forming potential of APC-deficient tumors. Mechanistically, STAT1 is downstream target of KRAS and is phosphorylated by its activating mutations. We found that enhanced IFN/STAT signaling in CFAP conferred resistance to MEK inhibitors. These findings reveal the crosstalk between RAS signaling and IFN/STAT signaling, which contributes to the tumor-forming potential and drug response. These results offer a rationale for targeting of IFN/STAT signaling and for the stratification of CRC patients. This article is protected by copyright. All rights reserved."
30723727,precision medicine,"Asthma and chronic obstructive pulmonary disease (COPD) have overlapping clinical features and share pathobiological mechanisms but are often considered distinct disorders. Prospective, observational studies across asthma, COPD and asthma-COPD overlap are limited. NOVELTY is a global, prospective observational 3-year study enrolling ∼12 000 patients ≥12 years of age from primary and specialist clinical practices in 19 countries (ClinicalTrials.gov identifier: NCT02760329). NOVELTY's primary objectives are to describe patient characteristics, treatment patterns and disease burden over time, and to identify phenotypes and molecular endotypes associated with differential outcomes over time in patients with a diagnosis/suspected diagnosis of asthma and/or COPD. NOVELTY aims to recruit real-world patients, unlike clinical studies with restrictive inclusion/exclusion criteria. Data collected at yearly intervals include clinical assessments, spirometry, biospecimens, patient-reported outcomes (PROs) and healthcare utilisation (HCU). PROs and HCU will also be collected 3-monthly <i>via</i> internet/telephone. Data will be used to identify phenotypes and endotypes associated with different trajectories for symptom burden, clinical progression or remission and HCU. Results may allow patient classification across obstructive lung disease by clinical outcomes and biomarker profile, rather than by conventional diagnostic labels and severity categories. NOVELTY will provide a rich data source on obstructive lung disease, to help improve patient outcomes and aid novel drug development."
30723321,precision medicine,Outcomes in patients with Fabry disease receiving migalastat during the phase 3 FACETS trial (NCT00925301) were evaluated by phenotype.
30723140,precision medicine,"Addition of alpelisib to fulvestrant significantly extended progression-free survival in PIK3CA-mutant, hormone receptor-positive (HR+) advanced/metastatic breast cancer in the phase III SOLAR-1 study. The combination of alpelisib and letrozole also had promising activity in phase I studies of HR+ advanced/metastatic breast cancer. NEO-ORB aimed to determine if addition of alpelisib to letrozole could increase response rates in the neoadjuvant setting."
30722070,precision medicine,"Cardiovascular and especially thrombotic diseases remain a major cause of morbidity and mortality worldwide. In past years, significant improvements in understanding disease processes, risk assessment, and prediction of clinical outcome in the field of thrombosis and haemostasis have been made by using large-scale biodatabases. These important research resources enable a comprehensive research approach by integrating clinical, environmental, genomic, and molecular information. Cutting edge, high throughput technologies open new data dimensions for clinical large-scale investigations. Joining multiple information levels from several pathophysiological pathways in contrast to a single marker approach might better model the complexity of disease pathogenesis. This review focuses on the possibilities that ultimately allow conducting wide-scale analyses for unravelling the multifaceted interplay between coagulation and cellular (e.g., platelets) elements in the development of thrombotic disease. It further provides examples for the use of biodatabases in the field of venous thromboembolism, explores the links between venous and arterial thrombotic diseases, and finally informs on the current use of platelet biomarkers in the thrombosis and haemostasis field."
30722038,precision medicine,"FBXW7, a classic tumor suppressor, is a substrate recognition subunit of the Skp1-cullin-F-box (SCF) ubiquitin ligase that targets oncoproteins for ubiquitination and degradation. We recently found that FBXW7 is recruited to DNA damage sites to facilitate nonhomologous end-joining (NHEJ). The detailed underlying molecular mechanism, however, remains elusive. Here we report that the WD40 domain of FBXW7, which is responsible for substrate binding and frequently mutated in human cancers, binds to poly(ADP-ribose) (PAR) immediately following DNA damage and mediates rapid recruitment of FBXW7 to DNA damage sites, whereas ATM-mediated FBXW7 phosphorylation promotes its retention at DNA damage sites. Cancer-associated arginine mutations in the WD40 domain (R465H, R479Q and R505C) abolish both FBXW7 interaction with PAR and recruitment to DNA damage sites, causing inhibition of XRCC4 polyubiquitination and NHEJ. Furthermore, inhibition or silencing of poly(ADP-ribose) polymerase 1 (PARP1) inhibits PAR-mediated recruitment of FBXW7 to the DNA damage sites. Taken together, our study demonstrates that the WD40 domain of FBXW7 is a novel PAR-binding motif that facilitates early recruitment of FBXW7 to DNA damage sites for subsequent NHEJ repair. Abrogation of this ability seen in cancer-derived FBXW7 mutations provides a molecular mechanism for defective DNA repair, eventually leading to genome instability."
30722034,precision medicine,"Latent tuberculosis infection (LTBI) is estimated in nearly one quarter of the world's population, and of those immunocompetent and infected ~10% will proceed to active tuberculosis (TB). Current diagnostics cannot definitively identify LTBI and provide no insight into reactivation risk, thereby defining an unmet diagnostic challenge of incredible global significance. We introduce a new machine-learning-driven approach to LTBI diagnostics that leverages a high throughput, multiplexed cytokine detection technology and powerful bioinformatics to reveal multi-marker signatures for LTBI diagnosis and risk stratification. This approach is enabled through an individualized normalization procedure that allows disease-relevant biomarker signatures to be revealed despite heterogeneity in basal immune response. Specifically, cytokines secreted from antigen-challenged peripheral blood mononuclear cells were detected using silicon photonic sensor arrays and multidimensional data correlation of individually-normalized immune responses revealed signatures important for LTBI status. These results demonstrate a powerful combination of multiplexed biomarker detection technologies, precision immune normalization, and feature selection algorithms that revealed positively correlated multi-biomarker signatures for LTBI status and reactivation risk stratification from a relatively simple blood-based assay."
30721951,precision medicine,"MicroRNAs (miRNAs), a class of small non-coding RNA molecules, have been recognized as key post-transcriptional regulators associated with a multitude of human diseases. Global expression profiling studies have uncovered hundreds of miRNAs that are dysregulated in several diseases, and yielded many candidate biomarkers. This review will focus on miRNAs in endometriosis, a common chronic disease affecting nearly 10% of reproductive-aged women, which can cause pelvic pain, infertility, and a myriad of other symptoms. Endometriosis has delayed time-to-diagnosis when compared to other chronic diseases, as there is no current accurate, easily accessible, and non-invasive tool for diagnosis. Specific miRNAs have been identified as potential biomarkers for this disease in multiple studies. These and other miRNAs have been linked to target genes and functional pathways in disease specific pathophysiology. Highlighting investigations into the roles of tissue and circulating miRNAs in endometriosis, published through June 2018, this review summarizes new connections between miRNA expression and the pathophysiology of endometriosis, including impacts on fertility. Future applications of miRNA biomarkers for precision medicine in diagnosing and managing endometriosis treatment are also discussed."
30721267,precision medicine,"Heterogeneity is prevalent in cancer both between and within individuals. Although a few studies have identified several circulating microRNAs (miRNAs) for cancer diagnosis, the complete plasma miRNA profile for hepatocellular carcinoma (HCC) remains undefined, and whether the plasma miRNA profiles are heterogeneous is unknown. Here, we obtained individualized plasma miRNA profiles of both healthy subjects and HCC patients via genome-wide deep sequencing. Compared with the highly stable miRNA profile of the healthy subjects, the profile of the HCC patients was highly variable. Seven miRNAs were optimized as potential plasma-based biomarkers for HCC diagnosis. Combined with the clinical data of The Cancer Genome Atlas (TCGA) cohort, three out of the seven miRNAs were correlated with the survival of the HCC patients. To investigate the effect of cancer cells on the plasma miRNAs profile, we compared the most differentially expressed miRNAs between plasma and tissues. Furthermore, miRNAseq data of HCC patients from TCGA were recruited for comparisons. We found that the differences between plasma and tissue were inconsistent, suggesting that other cells in addition to cancer cells also contribute to plasma miRNAs. Using two HCC cancer cell lines, we examined the levels of seven differentially expressed miRNAs. The reverse direction of certain miRNAs alterations between cancer cells and media further confirmed that miRNAs may be selectively pump out by cancer cells."
30720794,precision medicine,"Medicine has always been characterized by a tension between the particular and the general. A clinician is obligated to treat the individual in front of her, yet she accomplishes this task by applying generalized knowledge that describes an abstract average but not necessarily a specific person. Efforts to systematize this process of moving between the particular and the general have led to the development of randomized controlled trials and large observational studies. Inclusion of tens of thousands of people in such studies, it is argued, will enhance the applicability of the data to more individual circumstances. Yet, as genetic sequencing data have become more widely obtained and used, there has been an increased focus on what has been broadly termed ""precision medicine"", a highly individualized approach to therapeutics. Moreover, advances in statistical methods have enabled researchers to use N-of-1 study data-traditionally considered too individualized to be broadly applicable-in new ways. This paper contextualizes these apparently modern debates with reference to historical arguments about methods of disease diagnosis and treatment, and earlier physicians' concerns about the tension between the particular and the general that is intrinsic to medical practice."
